<!-- pong_full.xml -->
<!-- XML Game Engine -->
<!-- author: beefviper -->
<!-- date: Sept 18, 2020 -->

<game xmlns:xsi="http://www.w3.org/2001/XMLSchema-instance" xsi:noNamespaceSchemaLocation="../assets/xmlgameengine.xsd">
  <!-- window -->
  <window name="Pong" width="1280" height="720" background="color.black" fullscreen="false" framerate="60" />
  <!-- variables -->
  <variables>
    <variable name="margin" value="30" />
    <variable name="text.size" value="256" />
    <variable name="logo.radius" value="100" />
    <variable name="ball.radius" value="10" />
    <variable name="width" value="30" />
    <variable name="height" value="150" />
    <variable name="step" value="2" />
  </variables>
  <!-- objects -->
  <objects>
    <!-- title -->
    <object name="title">
      <sprite src="text('PONG', text.size, 'color.red')" />
      <position x="window.width.center - 350" y="margin" />
      <velocity x="0" y="0" />
      <collisions enabled="false" />
    </object>
    <!-- logo -->
    <object name="logo">
      <sprite src="shape.circle(logo.radius,'color.green')" />
      <position x="window.width.center - logo.radius" y="window.height.center - logo.radius" />
      <velocity x="0" y="0" />
      <collisions enabled="false" />
    </object>
    <!-- ball -->
    <object name="ball">
      <sprite src="shape.circle(ball.radius,'color.green')" />
      <position x="window.width.center - ball.radius" y="window.height.center - ball.radius" />
      <velocity x="random.range(-7,7)" y="random.range(-3,3)" />
      <collisions enabled="true">
        <collision edge="vertical" action="bounce()" />
        <collision edge="left" action="inc('paddle2.score');reset()" />
        <collision edge="right" action="inc('paddle1.score');reset()" />
        <collision basic="basic" action="bounce()" />
      </collisions>
    </object>
    <!-- paddle1 -->
    <object name="paddle1" class="paddle">
      <sprite src="image('assets/paddle.jpg')" />
      <position x="window.left + margin" y="window.height.center - height / 2" />
      <velocity x="0" y="0" />
      <collisions enabled="true">
        <collision edge="vertical" action="stick()" />
      </collisions>
      <actions>
        <action name="up" value="move.up(step)" />
        <action name="down" value="move.down(step)" />
      </actions>
      <variables>
        <variable name="score" value="0" />
      </variables>
    </object>
    <!-- paddle2 -->
    <object name="paddle2" class="paddle">
      <sprite src="image('assets/paddle.jpg', 'flip.horizontal')" />
      <position x="window.right - margin - width" y="window.height.center - height / 2" />
      <velocity x="0" y="0" />
      <collisions enabled="true">
        <collision edge="vertical" action="stick()" />
      </collisions>
      <actions>
        <action name="up" value="move.up(step)" />
        <action name="down" value="move.down(step)" />
        <action name="left" value="move.left(step)" />
        <action name="right" value="move.right(step)" />
      </actions>
      <variables>
        <variable name="score" value="0" />
      </variables>
    </object>
    <!-- score1 -->
    <object name="score1">
      <sprite src="text(paddle1.score,128,'color.blue')" />
      <position x="window.width.center - 80" y="margin" />
      <velocity x="0" y="0" />
      <collisions enabled="false" />
    </object>
    <!-- score2 -->
    <object name="score2">
      <sprite src="text(paddle2.score,128,'color.red')" />
      <position x="window.width.center + 50" y="margin" />
      <velocity x="0" y="0" />
      <collisions enabled="false" />
    </object>
    <!-- paused -->
    <object name="paused">
      <sprite src="text('PAUSED',128,'color.white')" />
      <position x="window.width.center - 220" y="window.height.center - 100" />
      <velocity x="0" y="0" />
      <collisions enabled="false" />
    </object>
    <!-- gameover -->
    <object name="gameover">
      <sprite src="text('GAME OVER',128,'color.red')" />
      <position x="window.width.center - 340" y="window.height.center - 150" />
      <velocity x="0" y="0" />
      <collisions enabled="false" />
    </object>
    <!-- continue -->
    <object name="continue">
      <sprite src="text('spacebar to continue',48,'color.white')" />
      <position x="window.width.center - 260" y="window.height.center + 60" />
      <velocity x="0" y="0" />
      <collisions enabled="false" />
    </object>
  </objects>
  <!-- states -->
  <states>
    <!-- mainmenu -->
    <state name="mainmenu">
      <shows>
        <show object="title" />
        <show object="logo" />
      </shows>
      <inputs>
        <input button="space" action="state('playing')" />
        <input button="s" action="state('settings')" />
      </inputs>
    </state>
    <!-- settings -->
    <state name="settings">
      <shows>
        <show object="logo" />
      </shows>
      <inputs>
        <input button="escape" action="state()" />
      </inputs>
    </state>
    <!-- playing -->
    <state name="playing">
      <shows>
        <show object="ball" />
        <show object="paddle1" />
        <show object="paddle2" />
        <show object="score1" />
        <show object="score2" />
      </shows>
      <inputs>
        <input button="space" action="state('paused')" />
        <input button="q" action="action('paddle1', 'up')" />
        <input button="z" action="action('paddle1', 'down')" />
        <input button="up" action="action('paddle2', 'up')" />
        <input button="down" action="action('paddle2', 'down')" />
        <input button="left" action="action('paddle2', 'left')" />
        <input button="right" action="action('paddle2', 'right')" />
      </inputs>
      <conditions>
        <condition class="paddle" variable="score" value="15" action="state('gameover')" />
      </conditions>
    </state>
    <!-- paused -->
    <state name="paused">
      <shows>
        <show object="paused" />
      </shows>
      <inputs>
        <input button="space" action="state()"  />
      </inputs>
    </state>
    <!-- gameover -->
    <state name="gameover">
      <shows>
        <show object="gameover" />
        <show object="continue" />
      </shows>
      <inputs>
        <input button="space" action="state('mainmenu')" />
      </inputs>
    </state>
  </states>
</game>
